asset_id,title,description,keywords,library,category,subcategory,status,upload_by,upload_date,last_updated_by,last_update_date,admin_notes,bit_rate,dload_file_type,dload_resolution,dload_size
3824,Qualcomm_QLearn_Logo_Black_Horizontal.jpg,"Qualcomm QLearn Logo Lockup - Black, Horizontal, jpg Format","Qualcomm, QLearn, Logo, Lockup, Black, Horizontal, jpg",Qualcomm,Qualcomm Education,QLearn Horizontal Logo Lockups,,,Elysia,5/14/2015,Elysia,5/14/2015,,,JPEG,N/A,7kb
3825,Qualcomm_QLearn_Logo_Black_Horizontal.png,"Qualcomm QLearn Logo Lockup - Black, Horizontal, png Format","Qualcomm, QLearn, Logo, Lockup, Black, Horizontal, png",Qualcomm,Qualcomm Education,QLearn Horizontal Logo Lockups,,,Elysia,5/14/2015,Elysia,5/14/2015,,,PNG,72 dpi,2kb
3826,Qualcomm_QLearn_Logo_White_Horizontal.ai,"Qualcomm QLearn Logo Lockup - White, Horizontal, Ai Format","Qualcomm, QLearn, Logo, Lockup, White, Horizontal, Ai",Qualcomm,Qualcomm Education,QLearn Horizontal Logo Lockups,,,Elysia,5/14/2015,Elysia,5/14/2015,,,AI,N/A,1.1mb
3827,Qualcomm_QLearn_Logo_White_Horizontal.jpg,"Qualcomm QLearn Logo Lockup - White, Horizontal, jpg Format","Qualcomm, QLearn, Logo, Lockup, White, Horizontal, jpg",Qualcomm,Qualcomm Education,QLearn Horizontal Logo Lockups,,,Elysia,5/18/2015,Elysia,5/18/2015,,,JPEG,72 dpi,7kb
3828,Qualcomm_QLearn_Logo_White_Horizontal.png,"Qualcomm QLearn Logo Lockup - White, Horizontal, png Format","Qualcomm, QLearn, Logo, Lockup, White, Horizontal, png",Qualcomm,Qualcomm Education,QLearn Horizontal Logo Lockups,,,Elysia,5/18/2015,Elysia,5/18/2015,,,PNG,72 dpi,2kb
3832,PPT Icon Library,Icons to use in PPT presentations,"Qualcomm, PowerPoint, Icons, Library",Qualcomm,PowerPoint Materials | old,QCT PPT Icon Library,,,Brittany,5/28/2015,Elysia,12/7/2015,,,ZIP,N/A,1.5mb
3839,QTI_Logo-Black-Vertical.eps,"Qualcomm Technologies, Inc. (QTI) Logo - Black, Vertical, eps Format","Qualcomm, Technologies, Inc, QTI, Logo, Black, Vertical, eps",Qualcomm,Qualcomm Technologies,Logo Lockups,,,Brittany,6/8/2015,Elysia,7/15/2015,,,EPS,N/A,576kb
3840,QTI_Logo-Black-Horizontal.eps,"Qualcomm Technologies, Inc. (QTI) Logo - Black, Horizontal, eps Format ","Qualcomm, Technologies, Inc, QTI, Logo, Black, Horizontal, eps",Qualcomm,Qualcomm Technologies,Logo Lockups,,,Brittany,6/8/2015,Elysia,7/15/2015,,,EPS,N/A,592kb
3841,QTI_Logo-White-Horizontal.eps,"Qualcomm Technologies, Inc. (QTI) Logo- White, Horizontal, eps Format","Qualcomm, Technologies, Inc, QTI, Logo, White, Horizontal, eps",Qualcomm,Qualcomm Technologies,Logo Lockups,,,Brittany,6/8/2015,Elysia,7/15/2015,,,EPS,N/A,582kb
3842,QTI_Logo-Blue-Horizontal.eps,"Qualcomm Technologies, Inc (QTI) Logo - Blue, Horizontal, eps Format","Qualcomm, Technologies, Inc, QTI, Logo, Blue, Horizontal, eps",Qualcomm,Qualcomm Technologies,Logo Lockups,,,Brittany,6/8/2015,Elysia,7/15/2015,,,EPS,N/A,592kb
3843,QTI_Logo-White-Vertical.eps,"Qualcomm Technologies, Inc. (QTI)  Logo - White, Vertical, eps Format ","Qualcomm, Technologies, Inc, QTI, Logo, White, Vertical, eps",Qualcomm,Qualcomm Technologies,Logo Lockups,,,Brittany,6/8/2015,Elysia,7/15/2015,,,EPS,N/A,572kb
3844,QTI_Logo-Blue-Vertical.eps,"Qualcomm Technologies, Inc (QTI) Logo - Blue, Vertical, eps Format","Qualcomm, Technologies, Inc, QTI, Logo, Blue, Vertical, eps",Qualcomm,Qualcomm Technologies,Logo Lockups,,,Brittany,6/8/2015,Elysia,7/15/2015,,,EPS,N/A,575kb
3845,QTI_Logo-Guidelines.pdf,"Guidelines explaining when, where, and how to use the Qualcomm Technologies, Inc. (QTI) Logo Lockups","Qualcomm, QTI, Logo, Guidelines",Qualcomm,Qualcomm Technologies,Logo Lockup Guidelines,,,Brittany,6/8/2015,Elysia,7/15/2015,,,PDF,150 dpi,383kb
3846,Man with Wearable Holding Phone,A man holding a phone with a wearable on his wrist in front of a red car in a parking lot. ,"Qualcomm, Device, Wearable, Watch, Wrist, Cell Phone, Car, Parking lot",Qualcomm,Photography,Brand Photography,,,Brittany,6/11/2015,Brittany,6/11/2015,,,TIF,300 dpi,63.3mb
3847,Person Holding Tablet,Person holding a tablet in a lab environment ,"Qualcomm, Tablet, Lab, Devices",Qualcomm,Photography,Brand Photography,,,Brittany,6/11/2015,Brittany,6/11/2015,,,TIF,300 dpi,63.3mb
3848,Man Holding Tablet with Worker in Background,Man holding a tablet in a lab setting with a worker in the background,"Qualcomm, Tablet, Device, Engineer, Lab, Computer",Qualcomm,Photography,Brand Photography,,,Brittany,6/11/2015,Brittany,6/11/2015,,,TIF,300 dpi,63.3mb
3849,Person Holding and Pointing to Tablet,Person holding and pointing to tablet in lab setting,"Qualcomm, Tablet, Device, Pointing, Lab, Engineer",Qualcomm,Photography,Brand Photography,,,Brittany,6/11/2015,Brittany,6/11/2015,,,TIF,300 dpi,63.3mb
3850,Person holding Tablet in Office,Person holding and pointing to their tablet in an office setting,"Qualcomm, Tablet, Device, Office, Pointing",Qualcomm,Photography,Brand Photography,,,Brittany,6/11/2015,Brittany,6/11/2015,,,TIF,300 dpi,63.3mb
3851,Person Pointing to Tablet Home Screen,Person in office setting pointing to tablet home screen,"Qualcomm, Tablet, Device, Office, Home Screen, Pointing",Qualcomm,Photography,Brand Photography,,,Brittany,6/11/2015,Brittany,6/11/2015,,,TIF,300 dpi,63.3mb
3852,Person Looking at Tablet Homescreen,Person in office setting looking at a white tablet homescreen,"Qualcomm, Tablet, Office, Reading, Home-screen, white",Qualcomm,Photography,Brand Photography,,,Brittany,6/11/2015,Brittany,6/11/2015,,,TIF,300 dpi,63.3mb
3853,Person Checking Watch Wearable,Person inside checking watch wearable zoomed out,"Qualcomm, Wearable, Watch, Zoomed, Out, Inside",Qualcomm,Photography,Brand Photography,,,Brittany,6/11/2015,Brittany,6/11/2015,,,TIF,300 dpi,63.3mb
3854,Closeup of Person Checking Watch Wearable,Closeup photo of person checking watch wearable inside,"Qualcomm, Wearable, Watch, Closeup, Inside",Qualcomm,Photography,Brand Photography,,,Brittany,6/11/2015,Brittany,6/11/2015,,,TIF,300 dpi,63.3mb
3855,Person Typing on Cell Phone,Person typing on cell phone inside ,"Qualcomm, Cell Phone, Device, Typing, Inside",Qualcomm,Photography,Brand Photography,,,Brittany,6/11/2015,Brittany,6/11/2015,,,TIF,300 dpi,63.3mb
3856,Person Typing on Cell Phone,Person typing on cell phone inside ,"Qualcomm, Cell Phone, Device, Inside, Pointing",Qualcomm,Photography,Brand Photography,,,Brittany,6/11/2015,Brittany,6/11/2015,,,TIF,300 dpi,63.3mb
3857,Person Typing on Cell Phone,Person typing on cell phone with another person across in the background ,,Qualcomm,Photography,Brand Photography,,,Brittany,6/11/2015,Brittany,6/11/2015,,,TIF,300 dpi,63.3mb
3858,English_IDC_LTE_Broadcast.pdf,English IDC LTE Broadcast - PDF,"English, IDC, LTE, Broadcast, PDF",Qualcomm,Qualcomm Technologies,LTE Broadcast,,,Elysia,6/12/2015,Elysia,6/12/2015,,,PDF,150 dpi,366kb
3859,Simplified-Chinese_IDC_LTE_Broadcast.pdf,Simplified Chinese IDC LTE Broadcast - PDF,"Simplified, Chinese, IDC, LTE, Broadcast, PDF",Qualcomm,Qualcomm Technologies,LTE Broadcast,,,Elysia,6/12/2015,Elysia,6/12/2015,,,PDF,150 dpi,578kb
3860,Traditional-Chinese_IDC_LTE_Broadcast.pdf,Traditional Chinese IDC LTE Broadcast - PDF,"Traditional, Chinese, IDC, LTE, Broadcast, PDF",Qualcomm,Qualcomm Technologies,LTE Broadcast,,,Elysia,6/12/2015,Elysia,6/12/2015,,,PDF,150 dpi,696kb
3863,AllPlayAnimation_1280x720.mp4,"AllPlay Animation Video - 1280x720, mp4 Format","AllPlay, Animation, Video, mp4",Qualcomm,AllPlay,Video: AllPlay Animation,,,Elysia,6/18/2015,Elysia,6/18/2015,,6.34 Mbit/s,MP4,N/A,69.1mb
3864,AllPlayAnimation_1920x1080.mov,"AllPlay Animation Video - 1920x1080, MOV Format","AllPlay, Animation, Video, mov",Qualcomm,AllPlay,Video: AllPlay Animation,,,Elysia,6/18/2015,Elysia,6/18/2015,,7.36 Mbit/s,MOV,N/A,80.2mb
3865,AllPlayAnimation_1280x720.mov,"AllPlay Animation Video - 1280x720, MOV Format","AllPlay, Animation, Video, mov",Qualcomm,AllPlay,Video: AllPlay Animation,,,Elysia,6/18/2015,Elysia,6/18/2015,,3.15 Mbit/s,MOV,N/A,34.3mb
3866,AllPlayAnimation_1920x1080.mp4,"AllPlay Video Animation - 1920x1080, mp4 Format","AllPlay, Video, Animation, mp4",Qualcomm,AllPlay,Video: AllPlay Animation,,,Elysia,6/18/2015,Elysia,6/18/2015,,10.34 Mbit/s,MP4,N/A,112.7mb
3867,AllPlay_Icon_Black.eps,"Qualcomm AllPlay Icon - Black, eps Format","AllPlay, Icon, Black, eps",Qualcomm,AllPlay,Icons,,,Elysia,6/22/2015,Elysia,6/22/2015,,,EPS,N/A,704kb
3868,AllPlay_Icon_Black.jpg,"Qualcomm AllPlay Icon - Black, jpg Format","AllPlay, Icon, Black, jpg",Qualcomm,AllPlay,Icons,,,Elysia,6/22/2015,Elysia,6/22/2015,,,JPEG,300 dpi,117kb
3869,Man looking at Tablet,Man looking at his tablet in an office setting ,"Qualcomm, Tablet, Device, Man, Office",Qualcomm,Photography,Brand Photography,,,Brittany,6/22/2015,Brittany,6/22/2015,,,JPEG,72 dpi,9kb
3870,AllPlay_Icon_Blue.eps,"Qualcomm AllPlay Icon - Blue, eps Format","AllPlay, Icon, Blue, eps",Qualcomm,AllPlay,Icons,,,Elysia,6/22/2015,Elysia,6/22/2015,,,EPS,N/A,704kb
3871,AllPlay_Icon_Blue.jpg,"Qualcomm AllPlay Icon - Blue, jpg Format","AllPlay, Icon, Blue, jpg",Qualcomm,AllPlay,Icons,,,Elysia,6/22/2015,Elysia,6/22/2015,,,JPEG,300 dpi,155kb
3872,AllPlay_Icon_Gray.eps,"Qualcomm AllPlay Icon - Gray, eps Format","AllPlay, Icon, Gray, eps",Qualcomm,AllPlay,Icons,,,Elysia,6/22/2015,Elysia,6/22/2015,,,EPS,N/A,700kb
3873,Close_Up_of_Male_Checking_Watch_3873.jpg,Male checking smart watch outside,"Smart, Watch, Device, Male, Outside",Qualcomm,Photography,Brand Photography,,,Brittany,6/22/2015,Brittany,6/22/2015,,,JPEG,72 dpi,7kb
3874,Closeup_of_Someone_Checking_Phone_3874.jpg,Individual checking smart phone outside ,"Smart, Phone, Outside",Qualcomm,Photography,Brand Photography,,,Brittany,6/22/2015,Brittany,6/22/2015,,,JPEG,72 dpi,7kb
3875,Closeup_of_Tablet_in_Kitchen_3875.jpg,Closeup of someone checking their tablet in the kitchen,"Tablet, Kitchen, Closeup, Device",Qualcomm,Photography,Brand Photography,,,Brittany,6/22/2015,Brittany,6/22/2015,,,JPEG,72 dpi,10kb
3876,Close_Up_of_Tablet_in_Living_Room_3876.jpg,Closeup of someone checking their tablet in the living room with a TV in the background,"Tablet, Device, Living room, TV",Qualcomm,Photography,Brand Photography,,,Brittany,6/22/2015,Brittany,6/22/2015,,,JPEG,72 dpi,5kb
3877,Couple_in_Car_3877.jpg,Couple in car using smartphone,"Couple, Car, Smart, Phone, Device",Qualcomm,Photography,Brand Photography,,,Brittany,6/22/2015,Brittany,10/6/2015,,,JPEG,300 dpi,14kb
3878,Couple_talking_in_Car_3878.jpg,Couple talking in car with smart phone,"Couple, Car, Smart, Phone, Device, Talking",Qualcomm,Photography,Brand Photography,,,Brittany,6/22/2015,Brittany,6/22/2015,,,JPEG,72 dpi,14kb
3879,Employees_on_Couch_3879.jpg,Employees using their devices while sitting on the couch,"Employees, Tablet, Phone, Device, Couch, Talking",Qualcomm,Photography,Brand Photography,,,Brittany,6/22/2015,Brittany,6/22/2015,,,JPEG,72 dpi,18kb
3880,Employees_Talking_on_Couch_3880.jpg,Employees talking on the couch while using their devices,"Employees, Smart, Phone, Tablet, Device, Talking, Couch",Qualcomm,Photography,Brand Photography,,,Brittany,6/22/2015,Brittany,6/22/2015,,,JPEG,72 dpi,19kb
3881,Female_Using_Phone_While_Shopping_3881.jpg,Female using her smartphone while shopping at the mall,"Female, Shopping, Smart, Phone, Device, Mall",Qualcomm,Photography,Brand Photography,,,Brittany,6/22/2015,Brittany,6/22/2015,,,JPEG,72 dpi,10kb
3882,Female_Checking_Phone_in_Car_3882.jpg,Female passenger checking her phone in the car ,"Female, Passenger, Smart, Phone, Device, Driving, Car",Qualcomm,Photography,Brand Photography,,,Brittany,6/22/2015,Brittany,10/6/2015,,,JPEG,72 dpi,13kb
3883,Girl_Checking_Watch_in_Bathroom_3883.jpg,Female checking her smart watch in the bathroom,"Female, Smart, Watch, Bathroom, Device",Qualcomm,Photography,Brand Photography,,,Brittany,6/22/2015,Brittany,6/22/2015,,,JPEG,300 dpi,9.9mb
3884,Girl_Looking_at_Tablet_in_Living_Room_3884.jpg,Female checking her tablet in the living room,"Female, Tablet, Device, Living Room",Qualcomm,Photography,Brand Photography,,,Brittany,6/22/2015,Brittany,6/22/2015,,,JPEG,300 dpi,12.9mb
3885,Male_Checking_Phone_While_Shopping_3885.jpg,Male checking his phone while shopping at the mall ,"Male, Smart, Phone, Shopping, Mall, Device",Qualcomm,Photography,Brand Photography,,,Brittany,6/22/2015,Brittany,6/22/2015,,,JPEG,300 dpi,9.6mb
3886,Male_Checking_Watch_While_Shopping_3886.jpg,Male checking smart watch while shopping at the mall ,"Male, Shopping, Smart, Watch, Mall, Device",Qualcomm,Photography,Brand Photography,,,Brittany,6/22/2015,Brittany,6/22/2015,,,JPEG,300 dpi,13.4mb
3887,Male_Checking_Watch_While_Window_Shoppin_3887.jpg,Male looking at his smart watch while shopping at the mall ,"Male, Shopping, Smart, Watch, Device, Mall",Qualcomm,Photography,Brand Photography,,,Brittany,6/22/2015,Brittany,6/22/2015,,,JPEG,300 dpi,12.3mb
3888,Nurse_Helping_Elderly_Patient_with_Table_3888.jpg,Nurse helping elderly patient in living room with tablet ,"Patient, Nurse, Tablet, Device, Help",Qualcomm,Photography,Brand Photography,,,Brittany,6/22/2015,Brittany,6/22/2015,,,JPEG,300 dpi,14.5mb
3889,Person_Scanning_Menu_with_Phone_3889.jpg,Person scanning their food menu using their smart phone,"Smart, Phone, Menu, Device, Eating",Qualcomm,Photography,Brand Photography,,,Brittany,6/22/2015,Brittany,6/22/2015,,,JPEG,300 dpi,11.1mb
3890,Person_Checking_Phone_on_Staircase_3890.jpg,Person standing in the staircase looking at their phone,"Staircase, Smart, Phone, Device",Qualcomm,Photography,Brand Photography,,,Brittany,6/22/2015,Brittany,6/22/2015,,,JPEG,300 dpi,23.9mb
3891,Person_Checking_Screen_in_Car_3891.jpg,Passenger checking and pointing to the screen of the car,"Car, Driving, Screen, Device",Qualcomm,Photography,Brand Photography,,,Brittany,6/22/2015,Brittany,6/22/2015,,,JPEG,300 dpi,16.4mb
3892,Person_Checking_Tablet_Close_Up_in_Kitch_3892.jpg,Person checking their tablet while standing in the kitchen ,"Tablet, Device, Kitchen",Qualcomm,Photography,Brand Photography,,,Brittany,6/22/2015,Brittany,6/22/2015,,,JPEG,300 dpi,17.1mb
3893,Person Checking Tablet in Kitchen,Person checking their tablet while sitting in the kitchen ,"Tablet, Kitchen, Device",Qualcomm,Photography,Brand Photography,,,Brittany,6/22/2015,Brittany,6/22/2015,,,JPEG,300 dpi,18.2mb
3894,Person Driving Past a Biker,Person driving past a biker who is seen in their front view window,"Driving, Biker, Outside",Qualcomm,Photography,Brand Photography,,,Brittany,6/22/2015,Brittany,6/22/2015,,,JPEG,300 dpi,16.8mb
3895,Person Driving Near a Biker,Person driving their car near a biker who is passing by,"Driver, Bike, Driving, Outside",Qualcomm,Photography,Brand Photography,,,Brittany,6/22/2015,Brittany,6/22/2015,,,JPEG,300 dpi,17.8mb
3896,Person Using Phone to Take Picture of Meal,Person using their smart phone to take a picture of their meal.,"Smart, Phone, Device, Meal, Picture, Scan",Qualcomm,Photography,Brand Photography,,,Brittany,6/22/2015,Brittany,6/22/2015,,,JPEG,300 dpi,10.6mb
3897,Person Using Device to Unlock Car,Person using their device to unlock their vehicle,"Device, Vehicle, Unlock, Phone",Qualcomm,Photography,Brand Photography,,,Brittany,6/22/2015,Brittany,6/22/2015,,,JPEG,300 dpi,13.5mb
3898,Employee Looking at Tablet in Break Room,Female employee standing in break room checking her tablet ,"Female, Employee, Break, Room, Tablet, Device, Work",Qualcomm,Photography,Brand Photography,,,Brittany,6/22/2015,Brittany,6/22/2015,,,JPEG,300 dpi,45.8mb
3899,Runner Checking Smart Watch,Runner checking smart watch while outside on a run,"Runner, Running, Smart, Watch, Device, Outside",Qualcomm,Photography,Brand Photography,,,Brittany,6/22/2015,Brittany,6/22/2015,,,JPEG,300 dpi,9.1mb
3900,Two Male Engineers in Lab,Two male engineers looking at tablet in a lab setting ,"Engineer, Male, Tablet, Device, Lab, Work",Qualcomm,Photography,Brand Photography,,,Brittany,6/22/2015,Brittany,6/22/2015,,,JPEG,300 dpi,32.6mb
3901,Nurse Helping Patient,Nurse using a tablet to help patient ,"Nurse, Patient, Tablet, Device",Qualcomm,Photography,Brand Photography,,,Brittany,6/22/2015,Brittany,6/22/2015,,,JPEG,300 dpi,43mb
3902,Ariel View of Female in Living Room,Ariel view of a female in the living room looking at her tablet ,"Female, Living Room, Tablet, Device",Qualcomm,Photography,Brand Photography,,,Brittany,6/22/2015,Brittany,6/22/2015,,,JPEG,300 dpi,40.2mb
3903,AllPlay_Icon_Gray.jpg,"Qualcomm AllPlay Icon - Gray, jpg Format","AllPlay, Icon, Gray, jpg",Qualcomm,AllPlay,Icons,,,Elysia,6/23/2015,Elysia,6/23/2015,,,JPEG,300 dpi,103kb
3904,AllPlay_Icon_White.eps,"Qualcomm AllPlay Icon - White, eps Format","AllPlay, Icon, White, eps",Qualcomm,AllPlay,Icons,,,Elysia,6/23/2015,Elysia,6/23/2015,,,EPS,N/A,688kb
3905,AllPlay_Icon_White.jpg,"Qualcomm AllPlay Icon - White, jpg Format","AllPlay, Icon, White, jpg",Qualcomm,AllPlay,Icons,,,Elysia,6/23/2015,Elysia,6/23/2015,,,JPEG,300 dpi,112kb
3906,AllPlay_Horizontal_Identifier_Black.eps,"Qualcomm AllPlay Identifier - Horizontal, Black, eps format","AllPlay, Identifier, Horizontal, Black, eps",Qualcomm,AllPlay,Identifiers,,,Elysia,6/23/2015,Elysia,6/23/2015,,,EPS,N/A,708kb
3907,AllPlay_Horizontal_Identifier_Black.jpg,"Qualcomm AllPlay Identifier - Horizontal, Black, jpg format","AllPlay, Identifier, Horizontal, Black, jpg",Qualcomm,AllPlay,Identifiers,,,Elysia,6/23/2015,Elysia,6/23/2015,,,JPEG,300 dpi,84kb
3908,AllPlay_Horizontal_Identifier_White.eps,"Qualcomm AllPlay Identifier - Horizontal, White, eps format","AllPlay, Horizontal, Identifier, White, eps",Qualcomm,AllPlay,Identifiers,,,Elysia,6/23/2015,Elysia,6/23/2015,,,EPS,N/A,702kb
3909,AllPlay_Horizontal_Identifier_White.jpg,"Qualcomm AllPlay Identifier - Horizontal, White, jpg format","AllPlay, Identifier, Horizontal, White, jpg",Qualcomm,AllPlay,Identifiers,,,Elysia,6/23/2015,Elysia,6/23/2015,,,JPEG,300 dpi,85kb
3910,AllPlay_Vertical_Identifier_Black.eps,"Qualcomm AllPlay Identifier - Vertical, Black, eps Format","AllPlay. Identifier, Vertical, Black, eps",Qualcomm,AllPlay,Identifiers,,,Elysia,6/23/2015,Elysia,6/23/2015,,,EPS,N/A,783kb
3911,AllPlay_Vertical_Identifier_Black.jpg,"Qualcomm AllPlay Identifier - Vertical, Black, jpg Format","AllPlay, Identifier, Vertical, Black, jpg",Qualcomm,AllPlay,Identifiers,,,Elysia,6/23/2015,Elysia,6/23/2015,,,JPEG,300 dpi,114kb
3912,AllPlay_Vertical_Identifier_White.eps,"Qualcomm AllPlay Identifier - Vertical, White, eps Format","AllPlay, Identifier, Vertical, eps",Qualcomm,AllPlay,Identifiers,,,Elysia,6/23/2015,Elysia,6/23/2015,,,EPS,N/A,769kb
3913,AllPlay_Vertical_Identifier_White.jpg,"Qualcomm AllPlay Identifier - Vertical, White, jpg Format","AllPlay, Identifier, Vertical, White, jpg",Qualcomm,AllPlay,Identifiers,,,Elysia,6/23/2015,Elysia,6/23/2015,,,JPEG,300 dpi,115kb
3915,AllPlay_Horizontal_Signature_Black.eps,"Qualcomm AllPlay Signature - Horizontal, Black, eps Format","AllPlay, Signature, Horizontal, Black, eps",Qualcomm,AllPlay,Horizontal Signatures,,,Elysia,6/23/2015,Elysia,6/23/2015,,,EPS,N/A,309kb
3916,AllPlay_Horizontal_Signature_Black.jpg,"Qualcomm AllPlay Signature - Horizontal, Black, jpg Format","AllPlay, Signature, Horizontal, Black, jpg",Qualcomm,AllPlay,Horizontal Signatures,,,Elysia,6/23/2015,Elysia,6/23/2015,,,JPEG,300 dpi,72kb
3917,AllPlay_Horizontal_Signature_White.eps,"Qualcomm AllPlay Signature - Horizontal, White, eps Format","AllPlay, Signature, Horizontal, White, eps",Qualcomm,AllPlay,Horizontal Signatures,,,Elysia,6/23/2015,Elysia,6/23/2015,,,EPS,N/A,304kb
3918,AllPlay_Horizontal_Signature_White.jpg,"Qualcomm AllPlay Signature - Horizontal, White, jpg Format","AllPlay, Signature, Horizontal, White, jpg",Qualcomm,AllPlay,Horizontal Signatures,,,Elysia,6/23/2015,Elysia,6/23/2015,,,JPEG,300 dpi,76kb
3919,PoweredBy_AllPlay_Horizontal_Signature_Black.eps,"Qualcomm AllPlay Signature - Powered By, Horizontal, Black, eps Format","AllPlay, Signature, Powered, By, Horizontal, Black, eps",Qualcomm,AllPlay,Horizontal Signatures,,,Elysia,6/23/2015,Elysia,6/23/2015,,,EPS,N/A,1.2mb
3920,PoweredBy_AllPlay_Horizontal_Signature_Black.jpg,"Qualcomm AllPlay Signature - Powered By, Horizontal, Black, jpg Format","AllPlay, Signature, Powered, By, Horizontal, Black, jpg",Qualcomm,AllPlay,Horizontal Signatures,,,Elysia,6/23/2015,Elysia,6/23/2015,,,JPEG,300 dpi,56kb
3921,PoweredBy_AllPlay_Horizontal_Signature_FullColor.e,"Qualcomm AllPlay Signature - Powered By, Horizontal, Full Color, eps Format","AllPlay, Signature, Powered, By, Horizontal, Full, Color, eps",Qualcomm,AllPlay,Horizontal Signatures,,,Elysia,6/23/2015,Elysia,6/23/2015,,,EPS,N/A,1.1mb
3922,PoweredBy_AllPlay_Horizontal_Signature_FullColor.j,"Qualcomm AllPlay Signature - Powered By, Horizontal, Full Color, jpg Format","AllPlay, Signature, Powered, By, Horizontal, Full, Color, jpg",Qualcomm,AllPlay,Horizontal Signatures,,,Elysia,6/23/2015,Elysia,6/23/2015,,,JPEG,300 dpi,61kb
3923,PoweredBy_AllPlay_Horizontal_Signature_White.eps,"Qualcomm AllPlay Signature - Powered By, Horizontal, White, eps Format","AllPlay, Signature, Powered, By, Horizontal, White, eps",Qualcomm,AllPlay,Horizontal Signatures,,,Elysia,6/23/2015,Elysia,6/23/2015,,,EPS,N/A,1.1mb
3924,PoweredBy_AllPlay_Horizontal_Signature_White.jpg,"Qualcomm AllPlay Signature - Powered By, Horizontal, White, jpg Format","AllPlay, Signature, Powered, By, Horizontal, White, jpg",Qualcomm,AllPlay,Horizontal Signatures,,,Elysia,6/23/2015,Elysia,6/23/2015,,,JPEG,300 dpi,59kb
3925,AllPlay_Vertical_Signature_Black.eps,"Qualcomm AllPlay Signature - Vertical, Black, eps Format","AllPlay, Signature, Vertical, Black, eps",Qualcomm,AllPlay,Vertical Signatures,,,Elysia,6/23/2015,Elysia,6/23/2015,,,EPS,N/A,328kb
3926,AllPlay_Vertical_Signature_Black.jpg,"Qualcomm AllPlay Signature - Vertical, Black, jpg Format","AllPlay, Signature, Vertical, Black, jpg",Qualcomm,AllPlay,Vertical Signatures,,,Elysia,6/23/2015,Elysia,6/23/2015,,,JPEG,300 dpi,85kb
3927,AllPlay_Vertical_Signature_White.eps,"Qualcomm AllPlay Signature - Vertical, White, eps Format","AllPlay, Signature, Vertical, White, eps",Qualcomm,AllPlay,Vertical Signatures,,,Elysia,6/23/2015,Elysia,6/23/2015,,,EPS,N/A,319kb
3928,AllPlay_Vertical_Signature_White.jpg,"Qualcomm AllPlay Signature - Vertical, White, jpg Format","AllPlay, Signature, Vertical, White, jpg",Qualcomm,AllPlay,Vertical Signatures,,,Elysia,6/23/2015,Elysia,6/23/2015,,,JPEG,300 dpi,85kb
3929,PoweredBy_AllPlay_Vertical_Signature_Black.eps,"Qualcomm AllPlay Signature - Powered By, Vertical, Black, eps Format","AllPlay, Signature, Powered, By, Vertical, Black, eps",Qualcomm,AllPlay,Vertical Signatures,,,Elysia,6/23/2015,Elysia,6/23/2015,,,EPS,N/A,1.1mb
3930,PoweredBy_AllPlay_Vertical_Signature_Black.jpg,"Qualcomm AllPlay Signature - Powered By, Vertical, Black, jpg Format",,Qualcomm,AllPlay,Vertical Signatures,,,Elysia,6/23/2015,Elysia,6/23/2015,,,JPEG,300 dpi,62kb
3931,PoweredBy_AllPlay_Vertical_Signature_FullColor.eps,"Qualcomm AllPlay Signature - Powered By, Vertical, Full Color, eps Format","AllPlay, Signature, Powered, By, Vertical, Full Color, eps",Qualcomm,AllPlay,Vertical Signatures,,,Elysia,6/23/2015,Elysia,6/23/2015,,,EPS,N/A,1.1mb
3932,PoweredBy_AllPlay_Vertical_Signature_FullColor.jpg,"Qualcomm AllPlay Signature - Powered By, Vertical, Full Color, jpg Format","AllPlay, Signature, Powered, By, Vertical, Full, Color, jpg",Qualcomm,AllPlay,Vertical Signatures,,,Elysia,6/23/2015,Elysia,6/23/2015,,,JPEG,300 dpi,71kb
3933,PoweredBy_AllPlay_Vertical_Signature_White.eps,"Qualcomm AllPlay Signature - Powered By, Vertical, White, eps Format","AllPlay, Signature, Powered, By, Vertical, White, eps",Qualcomm,AllPlay,Vertical Signatures,,,Elysia,6/23/2015,Elysia,6/23/2015,,,EPS,N/A,1.1mb
3934,PoweredBy_AllPlay_Vertical_Signature_White.jpg,"Qualcomm AllPlay Signature - Powered By, Vertical, White, jpg Format","AllPlay, Signature, Powered, By, Vertical, White, jpg",Qualcomm,AllPlay,Vertical Signatures,,,Elysia,6/23/2015,Elysia,6/23/2015,,,JPEG,300 dpi,65kb
3938,Qualcomm-Atheros-Logo-Black.ai,"Qualcomm Atheros Logo Lockup - Black, Ai Format","Qualcomm, Atheros, Logo, Lockup, Ai, Black",Qualcomm,Qualcomm Atheros,,,,Elysia,7/6/2015,Elysia,7/7/2015,,,AI,N/A,61kb
3940,QC_Atheros_Logo_Guidelines.pdf,Qualcomm Atheros Logo Lockup Guidelines,"Qualcomm, Atheros, Logo, Lockup, Guidelines",Qualcomm,Qualcomm Atheros,Logo Lockup Guidelines,,,Elysia,7/6/2015,Elysia,7/7/2015,,,PDF,150 dpi,380kb
3947,Qualcomm-Atheros-Logo-Black.jpg,"Qualcomm Atheros Logo Lockup - Black, jpg Format","Qualcomm, Atheros, Logo, Lockup, Black, jpg",Qualcomm,Qualcomm Atheros,Logo Lockup,,,Elysia,7/7/2015,Elysia,7/7/2015,,,JPEG,72 dpi,8kb
3948,Qualcomm-Atheros-Logo-Black.png,"Qualcomm Atheros Logo Lockup - Black, png Format","Qualcomm, Atheros, Logo, Lockup, Black, png",Qualcomm,Qualcomm Atheros,Logo Lockup,,,Elysia,7/7/2015,Elysia,7/7/2015,,,PNG,72 dpi,5kb
3949,Qualcomm-Atheros-Logo-Blue.ai,"Qualcomm Atheros Logo Lockup - Blue, Ai Format","Qualcomm, Atheros, Logo, Lockup, Blue, Ai",Qualcomm,Qualcomm Atheros,Logo Lockup,,,Elysia,7/7/2015,Elysia,7/7/2015,,,AI,N/A,64kb
3950,Qualcomm-Atheros-Logo-Blue.jpg,"Qualcomm Atheros Logo Lockup - Blue, jpg Format","Qualcomm, Atheros, Logo, Lockup, Blue, jpg",Qualcomm,Qualcomm Atheros,Logo Lockup,,,Elysia,7/7/2015,Elysia,7/7/2015,,,JPEG,72 dpi,10kb
3951,Qualcomm-Atheros-Logo-Blue.png,"Qualcomm Atheros Logo Lockup - Blue, png Format","Qualcomm, Atheros, Logo, Lockup, Blue, png",Qualcomm,Qualcomm Atheros,Logo Lockup,,,Elysia,7/7/2015,Elysia,7/7/2015,,,PNG,72 dpi,6kb
3952,QC_Atheros_Logo_Guidelines.pdf,Qualcomm Atheros Logo Lockup Guidelines,"Qualcomm, Atheros, Logo, Lockup, Guidelines",Qualcomm,Qualcomm Atheros,Logo Lockup Guidelines,,,Elysia,7/7/2015,Elysia,7/7/2015,,,PDF,150 dpi,380kb
3953,Qualcomm-Atheros-Logo-Black.ai,"Qualcomm Atheros Logo Lockup - Black, Ai Format","Qualcomm, Atheros, Logo, Lockup, Black, Ai",Qualcomm,Qualcomm Atheros,Logo Lockups,,,Elysia,7/7/2015,Elysia,7/7/2015,,,AI,N/A,61kb
